exelente saludo nycity	train
hdpppp boludo merecer llevar raudal serio	train
alguno vez asuncion dejar ser aldea convertir ciudad	train
jajajar asi suspender	train
aldea alguno vez ser ciudad depender gente cambiar	train
mal nunca solucionar problema ente ser encargado	train
querer solo playa parte eby señor intendente record tambien dejar estadio liga	train
re encanta ser ultimo palabra traicionar dic jajar	train
hundimiento empedrado peligroso transito calle aregua metro tte g villalba pic twitter com jjandumgs	train
principio incendio controlado cbvp azara aco vera apoyo p m t lugar pic twitter com kwvosbx	train
japiro man odio	train
naty pongar carita quedar mejor sonrisa salir alma encantas encantar asi	train
si ver kuri hacer rato kilombo calle	train
mirar	train
agradecer dato procesamos denuncia	train
ia porar	train
bien dicho	train
trabajar	train
bueno ser paraguay	train
faltar doble fila foto completar	train
parecer señora apurado tomar cafecito importar tapar cebra estacionar nomas	train
consecuencia caer bus quitar comunicado dejense joder laburar carajo	train
atentis hoy jueves x mayo vice presidente sanchez camioneta s cebra camion s veredar pic twitter com omvvlfsaig	train
notable imaginate si haber ocurrir gobierno anterior oh wait	train
arreglo avda primero pdte interseccion madame lynch avda stma trinidad horrible	train
frente jefe lpm	train
idiota	train
esperar barran cordon avenida lleno arena	train
palabra muerte mas asociado nuevo rumbo cara matar niño	train
ciudadano deber aprender tirar basura calle ayudar	train
totalmente asi mejor uso dinero	train
peo re u	train
ser crer desgracia cart dar luz verde bandido asi noma ser lamentable nuevo rumbo	train
capo intendente relacion internacional ser necesario transformar ciudad fuerza	train
xenofobia	train
buen dia deberio aprender dar mejor utilidad medio servicio ciudadano mantener respeto hacia dema	train
coincido vivir niña asuncion hoy ver ir cambiar aplaudo	train
mayo vice presidente sanchez yat sra super educado guardia avisar hacer ok	train
hacer apurada tampoco ser bueno	train
jajajajajajaja sorry	train
jajajajajajaja	train
parir verguenza	train
hijo mil	train
odio trabajo colegio carajo	train
pyta	train
transito dia ver bache cosa	train
poder arreglar desastre	train
hija cuidate	train
gigante ser entrar todito mal	train
cagado jajaja	train
nderachorar maldito bache	train
casi asu caida edificio sino inundacion igualito	train
solo recalcar superviaducto ser mal construido	train
municipalidad recordar punto critico dia lluvia pic twitter com gyxddoriqe	train
excelente lamentablemente aca si andar detras terminar nunca	train
sorete mierda	train
pod pio crer caer jajajaj placer ascensor encima	train
excelente apoyo	train
inutil oportunista hacer campaña politico costa desgracia ajeno	train
seguir asi	train
habilitar camara semaforos inteligent	train
alguno tramo desague pluvial	train
gracia aviso pic twitter com csgryrqh	train
recolector extorsionar pedir mil llevar dos bolsa basura osino dejar noma tirado ahi acaso pagar impsts par	train
arrojar basura dia lluvia pic twitter com sccpvpjfc	train
mario cada vez usa erradiqu morir mas gente risa ahogado raudal	train
foto retuit ver si arreglamos elemplo rio janeiro calle comecipar rota	train
mario fuerza na intendente demasiado cosa prometistale ahora convocar ciudadania ayudar	train
esperar cumplir gran adelanto ear respuesta solo salgueiro responder dem semana	train
shoping sol	train
retweted dgrrd lluvia lluvia basura basurero	train
si ir seguir hacer cosa medias seguir ser populista ir mejorar nunca	train
vendedor forma irregular lugar cuantas veces ser desalojar ser modo comparacion tema viaducto	train
hoy haber oficial pmt rca argentino trafico mas fluido frente colegio bastar	train
ir prohibir giro izquierda frente mc donals	train
ser buen idea trabajar alcantarillado	train
vehiculo involucrado accidente retirado p m t despejar calzada pic twitter com noehjgejy	train
cobertura p m t zona institucion educativo asuncion pic twitter com znvlxohm	train
ser bueno impulsar vehiculo electrico py emision co menos ruido mas punto recarga ayudaria	train
importante ser terminar ojala ser calidad material usar fuerza q seguir asi tratar arreglar q nunca izo	train
ahhh aca notar trabaja quejar x twitter mientras paciente morir pasillo vez trabajar	train
tener q ver sicario q comentario mas estupido reclamalir ministro interior presidente	train
olvidastir q escandalo hacer gente xq saco ahi	train
viaducto hacer mopc x ser co q dice hacer listo llevar licitacion vendedor querer mudar	train
ahi distir respuesta reclamalir ala essap jajaja	train
lluvia lluvia basura basurero	train
mas valer	train
pic twitter com ixgdtlj	train
hablaste television coreano contestar aparato	train
cierto poder cruzar to e u caballero	train
gente venir camuflado empresarioa clase alto capitalista extranjero vender patria vend madre	train
ikua drumar	train
hacer hora seguir esperar responder numero ley violar conductor	train
oportunista	train
donir mas semaforo inteligente	train
ver accidente mejor dicho quedar pikup	train
mes hacer complicado menos mal ser viaducto asi teniar hacer lamentable señor intendente	train
bien tambien urge despejen lomitero ocupar noche paseo bruno guggiari clientela cerrar paso vehicular	train
asimismo eusebio ayala tener vereda ocupado	train
cierto	train
arquitecto diseñar paseo central avda ta pio querer visitar tambien pavao	train
narco politica cart esperar candidato pdte ahora dio libre alguno forma	train
canalizar unidad semaforo señor cabrerar inquietud	train
felicidad buen trabajo haganlo viernes sabado multen gente aprendo	train
preocupar semaforo tacuary e u brasil verdadero sufrimiento dia adm pasar	train
eusebio ayala zona petirossi vendedor mueble juguet ser dueño vereda estacionamiento	train
ir preferencial asi camioneta debio pararr cada calle cruzar ta haber señal pare	train
puta gente explicar ser verguenza policia municipal o_ir	train
doler solo doler corrupcion reinante impunidad indiferencia doler poder ser mejor mas	train
cualquiera cosa bajar	train
sero poder hacer mismo rca colombia mandar mueble menos tributar	train
hipocrita	train
concejal	train
despues tipo decir ser politico distinto favor gran caradura resultar ser	train
gracia	train
departamento ñembucu mision paraguari itapua cordillero central caguazu cazapa guaier sur san pedro	train
madrugada mañana jueves	train
consulta cuadra casa haber estacion servicio frente mismo gente tomar cerveza llamar denunciar	train
bien	train
bien	train
despeje calzada zona lomiterio aviador chaco c san martin pic twitter com agpflapr	train
super viaducto construir año llevar año medio aun seguir tratar terminar impresentable	train
horario estimado	train
atencion esperar lluvia intenso rafaga viento poder superar km h caida rayo granizo pic twitter com oalcssf	train
cosa ordenar pues terminir obra paseo central viva calle cerrar san martin	train
mario defiendo trabajo retraso ser indefendibl superviaducto termino mas rapido	train
asuncion	train
compañia soporte venir bien dupla trio	train
contastir nivel alepo	train
si verdad parecer tomar cuenta alguno punto tacuary parapiti ser via salida hacia centro ta	train
cumplir año tema casi mismo tiempo construccion edificio	train
mbae solidaridad pik riar cara paraguayo	train
cres pioir ir hacer caso decir si simple bache poder tapar menos ir solucionar pedis kp	train
buena noche derivir tambien poder registrar denuncia atencion ciudadano pic twitter com wjgrtcliw	train
buena tarde sr gonzalez poder indicar mas detall relacion denuncia favor fin tomar medida correspondiente	train
excelente	train
bien	train
bien	train
hiciste calle sajonia desastre candidatar nuevo dio	train
ir pedir junta sacar ordenanza prohir crimen tipo fronterizo asuncion	train
capaz cambiar rendir boleta multa mañajajajajajajajo	train
seguir caño roto mas hora verguenza	train
felicitacion dr equipo trabajar fuerza	train
hora descanso capaz mañana metar empanadita coca contestar	train
decir dos patrullera grua supervisar transaccion ser exitoso repartija	train
tomar molostia responder entender importar	train
felicitacion equipo trabajo seguir trabajar dejar tirado quitar	train
seguro haber sumario informar resuelto parte	train
procesamos denuncia	train
privatizacion espacio publico agostopic twitter com xnokkoaff	train
necesario intendente asi faltar calle fuerza seguir arreglar nunca asi mejoro asuncion	train
felicitacion intendente dignar presencia	train
jajajajajaja mbore jajajajajaja	train
haber trabajar dia necesitar verdadero equipo trabajo remocion extincion maquinaria pesado	train
registrado gracia	train
ahora experimento salir mal ojala acertar	train
trabajar cagado decis muchacho acordar vo paso itaipu tranqui claritir	train
menos intentar forma mil veces reclamar haber caso gente evidentemente colaborar haber m u l t r proyectar tipo trabajo pasar mismo lugar mismo hora	train
ise mismo pregunta aparecer lugo periodista q siempre clamar igualdad cero impugnidad ahora n	train
pasar direccion laboral tipo verguenza maneja filma twittear come chicle hablar celular	train
favor pmt si multar muchacho manejar usar celular peligro ser	train
asi mismo febrero guau hacer arrancar clase despues rascar dos mano	train
colegio nio ser mismo saber hora ser si ir igual mover estacionar mal	train
ser diciembre ser mas proyecto haber decir terminarir dia	train
todavia entender legislativo municipal ser organo autonomo fin aca pdte junta ser administrador responsable	train
anoche santa rosa españa mcal lopez pic twitter com hgbhhpwl	train
gente quejar obra demorar ignorar intendent hacer respecto nar ñame ei voi gusto	train
registrar denuncia	train
p m t apoyar policia nacional barrio manoro zona hecho supuesto asesinato encargo pic twitter com zllotukpv	train
minimo tener hacer ciudad haber dejar hacer	train
pedir concejal tener posicion unanime ocasion anterior	train
colegio almena	train
mientras sicario cobrar vida niña	train
manera ofender ciudad	train
contestar comunicado firma negar completar trabajo faltar	train
colegio almena legion civil pacheco	train
direccion favor	train
tal si conductor poner parte tambien cosa si semaforo respetar mejor poner pmt coimeir	train
ir hacer salida colegio santa clara pedir asfaltar calle tapar bache pic twitter com mtodicdel	train
escribir borre fin vez realmente siquiera valer pena discutir partiendo pregunta molost responder	train
q tener q ver intendente ahi concejal q tener lleno planillero ahi junta q deber dar cara ayalar wagner blasco	train
podria recaudar municipio aunque ser inutil resultastir pic twitter com hirjg	train
putar mov sacar padre culo pesado pic twitter com gintxsfye	train
linea ves	train
pasar caradura grua rondar ver salia bien transaccion vez agilizar transito ser funcion	train
ser bueno poner pmt frente darsenas omnibus ingresar volver parar avda obstaculizando multenlo	train
ahora hugo poder organizar artista querer pintar propaganda electoral ilegal	train
presentar antecedente gestion realizar resolver tema playa pic twitter com htfopqkzz	train
atras br aviador aprox ubicacion pic twitter com oxjssjbl	train
recomendacion tener cuenta pic twitter com jakcxdrc	train
volve ataque ser nunca debistar salir veleta resentido	train
encima patrullera cruzar esperar projimo cambiar recaudacion	train
jjjajjjjjajajajajja	train
zorro asuncion formar fila cambiar peso argentino cobrar peso ja ja coimero	train
excelente tardo año terminar tiempo felicitacion feroz clavo	train
mofas sr intedente si obra hacer tiempo llevar culminar pasar muchisimo tiempo verguenza ajena	train
nuevamente casi decena limpiavidrio ubicado españa sacramento siempre violentos pic twitter com tzthztpukz	train
calle yaguar tte villalbar km via ferrea loma pyta parecer calle bagdag pic twitter com hzzobknnl	train
jajajajar	train
genial primero gobienro municipal prestar atencion cosa bravo	train
sr intendente calle er presidente dar pena punta punta solo pavimento hacia mlinch ser arenal	train
tb multar micro q usar ayer frenar sacramento entrar parada dentro mismo habiar auto estacionado	train
horama voi	train
mariscal lopez gral garay andar semaforo apagado	train
mes hacer empezar darsena verguenza	train
gracias	train
mes x obra	train
vez mas hacer mas	train
habilitar	train
gran estacionamiento vendedor nuevamente invadir vereda ips	train
partir señora ta colectivo jugar especie carrera	train
brillante	train
haber comunicar vialidad gracias reporte	train
ser hora hacer mes terminir vez favor	train
tener ver junta municipal	train
bien	train
bien	train
quedo resentido candidato intendente asuncion plra	train
reclamar tener capacidad gestion basura bateria pila aplicar ley mas debil	train
tremendir bache dps reparacion genaro romero esquin tte marcelino ayalapic twitter com icfjcowv	train
gracias	train
ahora manual uso favor	train
buena tarde derivir inmediatamente gracias reporte	train
notar trabajar	train
nadie atender llamar linea bajo cpj	train
tipo trabajar si ña cart obligar tuitear cantidad minimo semana ten esforzartir mas viejo	train
gracia dato derivamos vialidad orden	train
pasar derivar queja nadie venir solucionar haganse cargo kilombo armar f machain cerrar kostianovsky pedo	train
que alguien enseñe educacion vial conductor	train
par liberal wagner	train
bien olvidar adecuada señaletico horizontal vertical	train
hacer tiempo venir pedir señalizar tambien san rafael ntro sra carmen	train
deberia orgulloso obra poder durar mes durar mas año ser buen gestion haber excusa	train
tomar nota federico gracias preocupacion	train
ipukuetereimo voi don mario obra nunca ndopai saludo	train
bien mario ultimo ser desafortunado bacheo pryctda deberia pegar vuelta ahi autoelogiarte	train
ser amigo bajar montevideo entrar costanera acceso atras palacio serio	train
poder ser cartel pare antequera tte fariña pintura asfalto evitar accidente esquina ir varios	train
estafar obra mario jamas poder durar q duro sino sobrefacturacion	train
bien faltar mas hacer falta dejar crecer envialir alguno muni pedo	train
querer tomar estupido decir decreto hc autorizar usar abusar ehe favor arias	train
aerolinea magno otravez	train
tener nadie criticar si ser mario ferreiro billete hc permitir hablar fuerte	train
decir ayer tipo recorrer asu solo encontrar alguno cosa criticar mario funcionario	train
mexico cartel pare gente saber mirar respetar señal transito	train
gana sacar contexto cosa	train
ser q ir enviar lista completo empezar x dj q mas x tele contar chiste malo q trabajar	train
excelente aclaratorio muni ahora consulta ayudar crater tambien	train
epillapio camarado peor ñandir barbaro	train
agradecido procesamos denuncia	train
linea mas agrar vez	train
agradecer dato procesamos denuncia	train
eguro da noma cuentar tar trabajar	train
aipotar nde jao porar hikuai atu ver pio trabajar	train
ayer hacer vista gordo ceferino villagro mariscal lopez boggiani claro ser evento colorete peña	train
sun kilombo bolo seguir comprar registro	train
si trabajar ahi tendria quejarte	train
proxima tener traer escalera gustar jajajajar	train
semaforo tacuary herrera funcionar	train
trabajar notar perfectamente	train
bastar generalizar pq si nomar pq parecer mas facil si venir gran velocidad colectivo haber quedar boca calle	train
casi av artigas frente data systems	train
estir trabajar ver agente transito movil ingresar contramano	train
haber arribado costar ntra sra tacuari circular zona saber ser clasico salir golpe transver	train
mismo trabajo porqueria guido spano octubre gomez castro casi mcal lopez inutil	train
peru interseccion ser favor	train
conocer zona saber ser normal s mexico crucir casi mirar golpe tener zona ta subida	train
ser saber mal q manejar chofer cumplir ronda cronometrada cuesta pago ser tener culpa bondi	train
deber disminuir marcha bocacall si ser dos calle mismo categoria vehiculo venir derecha tener pref	train
mas linea	train
linea ser peligro mortal ojo	train
dar caracter preferencial to proyectado solo señal pare resto regir norma transito	train
seguir ser culpa colectivo pq vez pasado ocasionar accidente si tener culpa tambien pq ser colectivo	train
si linea arribar ta impactar camioneta haber si mal recordar señal pare esq s mexico	train
trabajo equipo minguir plaza cancha mirador bañado norte pic twitter com dkkyk	train
ntra sra independencia yegro iturbe caballero mexico cruzar ta ser transversal	train
si agregamos ta ser preferencial colon eu ntra sra tacuari haber pendiente cuesta subida	train
linea ir matar mas aun acordate ser animal manejar si nio correr cerro coro ej	train
papel triste clari serio	train
comentario mas abajo poder apreciar tener idea ser calle preferencial	train
linea jeymo pio andar rapido autobus ta lamnetable	train
aca oler fuertisimo billete hc	train
excelente	train
ser mas bien imprudencia conductor	train
pmt ser basura pra coimear tiempo centro controlandol chofer asesino	train
trabajar nio clari ser tambien boludo viejo	train
ojala recibir alguno sancion gente ensuciar pais despues querer hacer buen politico	train
vez cubrir semaforo exijar cumplimiento d norma d estacionamiento ej maestro malutin senador long imposible pasar	train
entonces tener comprar patin volar volver futuro decir alcanzar semaforo asi	train
pobre chofer idea haber tener infraccion	train
pmt pablo gracias	train
bestia entuemdir señal arrastran paso	train
pasar perrito dentro movil veterinario	train
despues querer multar gente pregonar ejemplo señor pic twitter com cekutapx	train
accidente transito mexico ta pic twitter com omwycwakv	train
agradecer dato procesamos denuncia	train
ser malisimo idea haber sacar semaforo calle ta pyda	train
cuanto mas choqu menos vehiculo calle mayoria tener seguro resto reparar rapido	train
destrozo dejado essap barrio tacumbu vergonzoso trabajo atencion	train
aeropuerto acaso lucar entender hina	train
linea n respetar	train
dudar local tener condicion minimo higiene vender comida	train
controlar polucion sonoro quinto reubicado usar medio calzada mal	train
susan brevedad compañero zona saludo	train
municipalidad desastre	train
line jeymo	train
pensar permitir cerro construir bandeja xq pilar quedar vereda si construir	train
mexico haber cartel deo parir	train
q pasar recolector casi semana pasar tte vera casi denis roa	train
line jeymar involucrado	train
clausurir radio pirata radio kms	train
llamada proyectado ser ta perro pensar ser aratiri	train
linea correr loco producir accidente nadie detener q bajen velocidad menos q	train
linea andar loco	train
parecer cm ser planillero mas	train
magno convertir linea santaniana	train
comenzar enseñar conductor calle preferencial respetar tenes esperar cruzar	train
partir ley transito confusas simple q deber ser modificar bien	train
line nuevamente terrible competencia aerolinea	train
increible muni zona centrico alrededor abandonado mierdar hacer seudo intendente	train
calle transversal tener colocar urgentemente	train
cansado discutir cuidacoch corazon pedir hacer	train
esquina largo ta ser jodir perro entrar clasificar	train
raro linea andar loco personaje jc	train
ahora accidente bla garay mexico colocar reductor señal transito visible largo corredor pic twitter com udppdykid	train
pensar igual vo despues decir haber servir sino haer	train
volver suceder ser verdadero tragedia municipalidad deber multar cumplir medida seguridad	train
recomeir venir conocer zona sacar opinion	train
trabajo rapido punto inaugurar espacio comedor almuerzo hoy pic twitter com ffxngwpe	train
volante invisible jajajajjajar ridicu	train
haber ver medida seguridad implementar institucion publico privado afluencia gente	train
bueno ser sepa ler primero kriatura	train
ir mas foto hacer año limpiamos terreno podrido irresponsabilidad propietariopic twitter com tdjbuasi	train
llegar solucion inundacion pavimento absorbente	train
aplauso ahora realizar control correspondiente crer ir repintar	train
gracia plaza lindo serio pena destruyan	train
si haber calle transversal permitir giro izquierda	train
ver super bien lado acompañante	train
estacionar derecha luz stop dueño calle	train
ir vayan ir lindo iniciativo provechen	train
orden siempre	train
pic twitter com uotnciwqtl	train
peo listoma si poder	train
buen dia raul documentarte pedido ser recomendable presentar nota secretaria intendencia er piso bloque	train
caso tormenta favor evitar siguiente punto ciudad atte pic twitter com xgkyhcyy	train
ponelir sal amigo uta visto quizas ver	train
rosa dejar contacto pmt denunciar momento pic twitter com vrgsteyw	train
grabar lado acompañante ser bueno dia ayer haber ser ayuda	train
poder dar mano terreno baldio cansado limpiar q dueño hacer cargopic twitter com tvzpdbmwl	train
hacer reclamo si pasar arreglar querer q volver llamar ojala dar curso ser necesario pasar vida llamar	train
puro twitter preocupacion poli ahi ver haber prestar bota menos aun casco ahi	train
teodoro s mongelo casi gaudioso nuñez feroz cartel arnaldo metele garra mario librano basura	train
entrar asuncion haber propaganda arnaldo samaniego zona arayanesl zona identificacion	train
buen dia marco asi hacer gracias preocupacion	train
excelente campaña concientizacion pare metele na ser respetar cruce franja peatonal tambien	train
denuncia procesado	train
poder multar cada metros cuadrado propaganda ilegal	train
sancion tener gente ensucia	train
ver congreso ser reflejo	train
si ser frente biblioteca congreso ser seguridad funcionario palacio	train
madame lynch si	train
buen dia pmt conocimiento dirigir lugar	train
presencia señor intendente plaza valinotti pic twitter com tvckie	train
s santar rosa c españa atencion calle resientir pic twitter com axdgksudcm	train
cobertura p m t pacheco legion civil extranjero pic twitter com rfsbvlkn	train
pasar mcal lopez	train
parecer buen iniciativa	train
bien	train
bien	train
haber comunicar direccion pmt orden	train
buen dia hugo pedir control pmt gracias preocupacion	train
buen dia derivamos responsable area queja orden	train
imposible mariscal lopez hacer minuto tratar llegar san martin	train
tranco quilombo basura	train
parecer aplazar alguno materia semaforo inteligente mcal lopez terror trafico	train
foto nomas nomas pendeja quitar foto caminera	train
ser quilombo ser apenas llegar	train
informar carlos flechaber declaracion intendente	train
brillante	train
gracias inutilizar entrada kostianovsky dejar asi hacer mas mes pic twitter com mhbgfrr	train
romper tirar arena lavado listo solucionado verguenza	train
crer rompar calle deber dejarla condicion aco nadie importar pic twitter com otvinbmvuw	train
buen dia contacto policia nacional proceder oficio orden	train
ser enrejo plaza uruguaya permitiriar nadie acampir lugar	train
exteriores intendente asuncion visitar obra futuro parque educacion vial via carlos flechaber	train
multar motoquiero ahi saber	train
retweted muni asuncion ser buen ejemplo mas pequeño demostremo	train
dejar gente hacer plaza uruguaya costar muchisimo hermoseado	train
lindo hacer feroz embudo calle quinto cerrar boca	train
favor si poder hacer respecto avda mcal lopez casi venezuela desastre recoleta gracias pic twitter com tjfnfnrqx	train
peru mcal lopez	train
hablar	train
caño roto calle santa rosa avda mcal lopez avda españa pic twitter com bmmupvznp	train
am ser justo mas trafico haber deber cambiar horario ordenanza	train
tacuary f r moreno necesitamos agent transito horario entrada salido colegio padre prepotente	train
prever remodelacion completo plaza valinotti km	train
costo inversion ser mas menos millon guarani	train
niño ser veces terminar enseñar padre conducir via publico	train
mierrrcol haber mas trafico hoy entonces	train
intendente asuncion visita obra futuro parque educacion vial	train
direccion recurso humano junta municipal asuncion	train
favor hacer escuela barrio barrio san vicente pic twitter com kkepcjzsld	train
aviador chaco stma trinidad estacionar doble triple filar vehiculo p descenso estudiantes colegio iturbe pmt hacer	train
permitido bajar mercancia venta calle	train
falta cobertura mola lopez avda sacramento dificil cruce	train
permitir campesino acampar plaza uruguaya enrejada	train
gracia buen dia tambien	train
cobertura p m t avda artiga brasilia pic twitter com xkcygshghk	train
cobertura p m t avda artiga cap lombardo pic twitter com ipobaxgx	train
cobertura p m t avda mcal lopez san martin pic twitter com mavpkapbt	train
cobertura p m t zona institucion educativo asuncion pic twitter com zutvyqcctj	train
buen dia pedir monitoreo gracia dato	train
buen dia pedir control orden	train
tomar nota gabi gracias reporte orden	train
buen dia campaña realizar solo dentro ciudad asuncion	train
menos mal empleado municipal transgresor resto ciudadania haber multar pic twitter com syvehixasx	train
cobertura p m t rutar transchaco primero presidente pic twitter com xznhqwja	train
cobertura p m t predio d m pic twitter com ucjtdlpn	train
agradecer dato procesamos denuncia	train
copiado buen dia	train
buen dia luis ser direccion	train
porq permitir campesino instalar p uya ir destruir demandar esfuerzo recurso munic	train
independencia nacional c tte fariñar cuidacoch colocar caja via publico favor verificar	train
juntar monton camioncito enfrente obstaculizar paso dia urgente pic twitter com ffmwdpg	train
favor s calle von sastrow dtra abasto xste negocio cerrar calle m dia mismo pic twitter com oxpjufebwm	train
expliquenmar xq cerrar estacionamiento costanera detras palacio gobierno	train
cptan lombardo artigas parada taxi ocupar calzada luego camion transganados haber dia q poder transitar solucion xfa	train
seguir votar señor gente	train
pq alguno zangano muni salir hacer mismo mas calle buen iniciativa	train
dar	train
lamentable	train
aldea permitir tio cambalache	train
impresionante vista teneir cartel	train
pai permisismo robar cualquiera hora	train
