exelente saludo nycity	train
mario favorrr hace direccion sugiero eliminir giro izquierda san martin pic twitter com qbxmf	train
verdad hc tener ver cosa naturaleza noma	train
hc tener culpa	train
cruce menos pintar cordon	train
zona seccional quedar deyra parque carlos lopez pintar muralla hacer dia atras	train
desidia ser tema hacer reclamo aparecer despues dia asfalto destruir totalmente	train
plantearia tema caño roto asuncion si llegar diputado agua competencia	train
lent hacer invisible moto ferreirir mas mismo	train
mejor gracias produccion x incluir programa increible buenisimo	train
retweted mario ferreiro capacitar persona seguir dar	train
mirar ver oir escuchar cegado x poder	train
hoy mañana tapar municipalidad campaña politica espacio publico tarde llenar espacio pic twitter com olfcdlsqe	train
clotilde cabral ahi ser ex d russo	train
msmo hacer aca em barrio san jorge x fin asfaltar romper dejar asi	train
sr serio hacer ver asi	train
esperar q mario seguir figuretear tv mientras	train
serio burlar gente verguenza caer ciudad viejo hacer	train
que	train
españa sacramento feroz mural politico san martin tte vera tambien	train
comodo facil marketng costo pagar contribuyente mejor impedir ensucien limpiar suciedad sancion ser metod prevenc	train
deber retirar haber varios ciudad incluir candidato presidente avenida españa	train
faltar propaganda electronico pantalla gigante peron felix bogado	train
arregui vigilante tener aguante	train
corazon pedro votame	train
multa motoqueiro	train
haber demasiado cruz peligroso asu aumentar asfaltado masivo municipio seguir dormir	train
gracia responder solo querer saber si ser cierto nombre muro vo cierto entonces	train
mario jeymo invitado bajo nivel	train
mario favor agente pmt salida colegio san andres grua recorra juan salazar artiga padre cardozo	train
motoqueirir casco chaleco reflectivo zapatilla aupei	train
faltar telefuturo	train
tia vo saber querer saber si ser cierto ser vos ir responder señor populista	train
buena tarde gracia indicarno brevedad procederer retiro residuo saludo	train
querer sumar voto si responder señor	train
cuidacoch seguir apostado hacer	train
dima motta maestro bertoni aparte horribl bach pic twitter com yhbngljmd	train
cara duro ser	train
esperar eusebio ayala cordillero escuela inmaculada chico sexto grado pic twitter com ubjvcbaz	train
shi muestro	train
hijo mil cerca casa ser	train
nde tavyyy	train
telmo aquino casi chaco boreal	train
cobertura p m t avda artiga venezuela pic twitter com worexblp	train
ser cierto hora pico nadie pmt serio bueno poner semaforo	train
cobertura p m t avda artiga gral santo pic twitter com hseufudf	train
deber hacer ser sancionar ensuciar ciudad	train
ser veridico	train
espectacular poder crer eficiencia agradecer monton	train
felicitacion comuna deber minimo impugnar candidatura ensuciar	train
agente hora pico solucionar cuadras base pmt	train
parte faltar semaforo pasar loco dar paso favor ser dificil cruzar zona	train
semaforo hacer superviaducto justamente agilizar quer semaforo mts respetar ley transito hacer falta	train
agradecer dato procesamos denuncia	train
denuncia procesado	train
mario vivir ciudad hostil transeunte deber priorizar caminar	train
confiscar produccion devolver estir permitido algun metodo mas eficiente fuerza bruta costoso lento ineficiente	train
sancion respetar final laburo argel ser candidato ser intocable	train
ser cierto tener gastar tiempo dinero quitar propaganda pic twitter com fggolq	train
p q intervenir imprenta ser mas costoso sacar pegado impedir produzcar	train
haber q hacer cruce año hacer mismo trayecto ahi cada dia ser mayor descontrol haber agente ultimamente nadie	train
haber gente prepotente calle clase iniciativa ser digno aplaudir copiar forzar	train
buen iniciativa ser hora lugar convertir espacio espiritual gente dolido grande	train
gracia buena calle recibido	train
notar trabajo asuncion ser digno aplaudir grande	train
haber obra sucre casi motta tener cartel regulador controlar	train
dar incentivo porcentaje recaudacion evitarir coima ganaria mas	train
c iniciativa similar proteger preservar ambiente	train
parir alguno crer adorno excelente	train
aijue pucha orrible	train
accidente madame lynch primero presidente pic twitter com nvkdwvsxw	train
gs impuesto vo dej vengar vago cagar mear destrozar plaza asuncion hdp	train
pedis gente dia impuesto hacer mierda espacio verde tener	train
encargar limpieza inmueble intervenido calle bartolome ruiz petereby incienso pic twitter com bnosbbfm	train
agradecer dato	train
rodriguez francia	train
interseccion favor fin procesar denuncia	train
favor tambien facundo machain r i boqueron nadie respetar señal pare	train
vengar primero presidente artiga	train
obvio si	train
favor retirar cartel peligroso tapa visual vehiculo moto lillio esq capitan carmona favor pic twitter com ubtcnigq	train
mirar proyecto maqueta quiera	train
holar consulta hora pasar camion recolector basura zona mercado	train
pic twitter com fyvcvyutr	train
agradecer dato sr cesar	train
ah mirar ser proselitismo institucion publica	train
disculpar tener alguno respuesta positivo haber varios colega abogado qir preguntar ir unico q decidir menos escribir tw	train
gracias	train
venir bien	train
ahi costado iglosia cancha tambien haber pare dia pasar ahi nadie frenar solucionar multar unicamente	train
mirar	train
silencio	train
frente colegio san jose tambien porfa adorno servir	train
ser semana pasado preguntar haber respuesta	train
proposito ordenamiento toma conciencia ciudadano cuanto respeto norma transito ser tarea	train
conste q recien año	train
excelente	train
seguir sostener q despu caida dictadura intendent q pasar izo mil vez mas cosa q dema	train
esperar concienticir tambien uds tomen enserio denuncia preocupacion hacer ciudadano	train
seguir campaña concientizacion educacion vial distinto punto asuncion pic twitter com udslhqtb	train
campaña concientizacion educacion calle padre cardozo tte ruiz barrer merced pic twitter com glauxjqf	train
excelente calle asfaltar recien favor señalizar tipo cartel	train
ohhhhh seguro culpa tener ser causante mal pais	train
jefe consulta tecnico buscar permiso juego azar asuncion poder ver	train
ser responsable	train
condenado marquito	train
aiquena chismosar	train
buena tarde hacer consulta tecnico area orden	train
avenida brasilia francisco cowlan	train
poder estacionar doble fila quesada imposible circular asi	train
excelente	train
parir indicar calle lugano dar pref agosto deber ser reves calle oeste gralmente tener pref centro	train
excelente iniciativa ser crer alguno cartel pare calle equivocado ej lugano agosto	train
felicitacion intendente siga trabajar mejorar calle tiempo ser olvidada	train
excelente informacion saber eliminar pila bateria	train
procesamos denuncia	train
carlos centurion casi av fernando mora	train
gente entender aun contamina ambiente bien señor cometer criminal acumular	train
direccion señor	train
direccion favor	train
aplazado	train
bien mario cosa entrar repeticion	train
poder conseguir nota completo	train
ojala coimeir ves pic twitter com covjppzi	train
aqui haber cuadra artiga gral santos	train
alguien burlar alguien cero respeto pic twitter com bejsotpwnr	train
voto frente guashu amigo	train
fin bien	train
anulenmir multa injusto ser dia haber auto estacionado ciudadano ir sorteado unico dia controlar	train
holar venir sacar cartel prohibido estacionar tte moral adorno seguir estacionar	train
excelente gracia	train
buen iniciativa sr intendente solo q esquina crer mal cartel pare preferencial haber baden	train
despidar arquitecto urbanista diseñador error saludo	train
convencidisimo tipo campaña ser hacer falta ojala gente ser consciente	train
buen dia anibal continuacion imagen ser proyecto terminado paseo gastronomico ta avenida pic twitter com mhseyydwj	train
proyectista muni crer ser gallego	train
parir cada medio cuadra bache haber mercado lleno nuevamente intendente so buen dj	train
seguro si	train
hacer hacer	train
consejal vargas zona polideportivo san cristobal favor insistir tambien	train
paseo incluir tapar calle crear cao trafico	train
ser casaclari ahi poder vender pilsen i caña poder alquilar patio anr fg mientras segui justificar patron	train
bueno pasar ahi ser si haber pasar ayer	train
despues romp vo tranquilo nomas	train
menos hipo va tener jajaja	train
acabar responder	train
ser detalle palabra correcto ser carpido ente oficial deber cuidar gente ler publicar	train
exelente sr intendente lado educar cebra quedar encima	train
haber upei dejar entrar dejar detruir	train
contento destruir plaza frente congreso ahora ir dejar plaza uruguaya zona guerra municipalidad	train
deber hacer ser organizar nivel nacional volver obligatorio examen conduccion tener mayor efecto multiplicador sociedad	train
recomeir abonir forma hacer tiempo ahora querer reconocer pago lamentable	train
educacion vial falta hacer realmente iniciativa necesario	train
acuerdo pensamiento tema ser plaza uruguaya haber ir frente parlamento siempre	train
pare poder salvar vida felicitacion intendente hacer falta concienciar gente	train
proposito decir politico jamas manifestacion esper correcto	train
faltar educacion vial haber invertir mas mario hacer mas campaña ensambladora moto importador vehiculo	train
grande	train
quedar asipic twitter com quhmmsexb	train
tambien hacer falta semaforo rojo intermitente	train
porcar plaza uruguaya enrejar preservar justo empezar poner linda upei	train
jajajajajajajajajajar	train
avda def chaco c acceso sur mojon tambien mural propaganda politico favor borrar	train
crer sinceramente poder ganar eleccion	train
conversar oposicion desafio año venir ser demasiado grande	train
tambien bache agua chofer chaco pacheco mcal lopez varios	train
proceder retiro extemporanea av felix bogado ta proyectadapic twitter com qcveyter	train
ser tema reconocer traves censo ahora trabajar abasto	train
verguenza españa esquin dr morro rio ser perdido nomas arreglenlo favor gracias	train
hacer analisis mesurado tomar decision intervenir mercado abasto	train
espacio invertir plata plaza uruguaya esperar solucionar hoy campesino	train
cartel pare mostrar deber estacionar cualquiera cosa noma alzar jajjajajajaj	train
quedranto dar lugar ahora ver demolido terminar ser lindo excelente iniciaiva lujo	train
plaza uruguaya poder tiempo ser oportuno campesino alli	train
poder llegar solucionar hora pasar agua cuadra pic twitter com zoerzqwns	train
hablar intendente asuncion	train
multa	train
ser tipico ejemplo hazar decir hacer resultar simpatico cuestion	train
pai maravilla	train
suponer enrejo plaza uruguaya ser ordenanza municipal	train
realizar campaña respetar señal transito camion estacionar deber gentileza pic twitter com rlqpozho	train
agua borbotones s manuel dominguez parapiti atencion tremendo desperdicio pozo calle pic twitter com kgdsiwwty	train
primero presidente julio correo santisimo trinidad destruido vo pir maneja ciudad ver destruido carajo gran p	train
gracia pic twitter com ndywlkfk	train
mario ver construccion paseo volver llenar mesa silla peaton caminara pasillo angosto nvmente	train
usar parte predio gran parada bus ser bus q hacer q artiga ser lento zona	train
buen dia haber pedir mejora vialidad orden	train
pelicula calcado ser presidente	train
santi ir campera rojo alguno hurrero inauguracion lider cart mejoraremo si llegar senado	train
ser interesante publicar proyecto ciudadania tener derecho conocer informacion publico crer alguno deber ser asi	train
gracias	train
aclar hablar hablar surge mezclar decir si igual noma coherencia cero	train
ensuciar vista tener oficina	train
ser bar privado	train
gracias intendente ahi toque oido ojo	train
eli compañero proceder verificacion correspondiente saludo	train
porquer hacer ensanchar ser tema achicar	train
gral garay lillo necesitar campaña asap	train
igual aplicar tener interes propio ajeno bombardear candidato constantemente ser atentado	train
ser bar casa clari alquilar espacio dentro manzana rivera informate favor	train
anoche espectacular mas copado polemico	train
hacer campaña hoy ciudad ver si respetar mas señal invisible pic twitter com idxsvbuj	train
construir vida haber auto estacionado asi nunca tampoco ser avenida extenso encantar proyecto	train
bien costear gasto deber multar candidato dejar libre responsabilidad	train
decir lugar turistico pensar costanera sur	train
sugerencia relacion cerro lambare lindo serio poner luz parecido camboriu	train
santiaguir si poder ir vender orto conveniencia	train
reporte ser derivar vialidad orden	train
buen dia derivir vialidad solicitud gracias reporte	train
haber upei	train
buen dia derivamos solicitud orden	train
millon inversion dos camion renovacion flota ser necesario servicio ciudad	train
ser sicario periodistico comandado muñeco vudu vierci solo informar lado	train
buen dia derivir mopc mensaje orden	train
buen dia formar parte proyecto paseo gastronomico ta avenida gracias preguntar	train
referi articulo ser uhora publicar probado calumnia algun odio politico personal periodista	train
nio usar ser jaja usar usar	train
gracia	train
antonia pasar pedido area vial gracias reporte	train
buen dia pato derivir mensaje area transito orden	train
buen dia marcial ser denuncia poder visualizar	train
ser programa mas visto domingo	train
silvio paez hija ex defensor pueblo metio pariente funcion publicar nunca criticar gobierno	train
buen dia alexio gracia indicarno brevedad posible compañero retiro residuo	train
que seguir parte estir implantar mal destruir humedal entender	train
coincido crer tampoco ser lugar mitin politico aniversario anr ser saludar presi	train
poder estacionar caminar pasar ap solano escobar casi rio janeiro pic twitter com azknrdmnp	train
uso recurso ser alevoso debido presi querer blindar justicia senaduria	train
peor ser convertir acto inauguracion politico partidario	train
ver malo haber pedir permiso	train
negro mierda decir ganar palo vivir manguear canje sogueto mas	train
ten razon unidad militar deber ser apolitico mburubicha rogar si poder porq presidente ser politico	train
comitiva fiscal retirar propaganda politico felix bogado quinto avenida mañana hoy	train
mburuvicha rogo hacer mitin politico dia asi noma ser democracia gobernar traves partido politico	train
impuesto lamentable zurdo	train
ver foto palacio lopez fondo dar escalofrio momento pensar ser pesadilla	train
bien despilfarro sector amigo amigo pariente amante sector competir prioridad haber recurso	train
copiar chukipic twitter com hxohyudj	train
buen dia ser sistema poder acceder local	train
musica shakira utilizar ciego sorda mudo jajajar	train
coincido pasar ahi ver obra sentir condorito ser exijo explicacion	train
haupei	train
nuevo ir destruir plaza uruguaya acabar remozar x completo ahora	train
faltar ampliar avenida achicarla ser tendencia ser dificil entender	train
mario ir poder ver grada nuevo olla pasar direccion caballero	train
ir explicar q aun manifestar producto horticola llegar asuncion	train
buen dia paolo gracia escribirno brevedad procederer retiro saludo cordial	train
verdad comer medio carril ahora	train
lamentable ser poner construir puesto plaza ciudad ver	train
hacer llegar proyecto completo anibal nuevo paseo ta avenida ser mas lindo ciudad	train
entender ser hacer avenida asuncion construccion s boulevard achicar quinta caotico transito pic twitter com zpelzalen	train
pagar hacer bien chantir peña usar grati recurso pais ser simple candidato choto ir perder	train
procesamos denuncia	train
tramo felix bogado si poder emparejar tapar bache	train
aprobado municipalidad angosta ser calle ta avda pic twitter com mknkjpbod	train
podriar pasar buscar resto planta embolsado estir lado casa julio concejal vargas	train
mario saber cara interventor ser mas sospechoso director renunciante mmmmm amalicia amalicia hina	train
usar dinero contribuyente tapar pelotudez tapar bache cuandocuanto faltar eleccion municipal	train
pais cosa ver dueño deber encargar remocion	train
ser sicario periodistico aconsejar lea articulo respecto entienda	train
sensacional	train
fondo ser utilizar cubrir costo pintura tapar cartel electoral dr jorge rivas	train
hoy ir proceder tapar carteleria politico encontrar via publico dr jorge rivas	train
ir extrañar si vez recordar ser gobierno ocupar sede militar hacer mitin politico	train
horama	train
haber q decir q hacer imbecil farsante	train
excelente	train
clima acompaño igual trabajar playa mboi ka faltar aun tiempo	train
enorme recuerdo charly garcia paraguay pic twitter com mlensqju	train
haber upei	train
av peron l m araña enorme cartel luminoso marito polucion luminico propaganda tiempo	train
alguno dia vida esperar poder cambiar foquito viaducto ñu guazu saber decir alguien	train
gracia visitar pic twitter com cekolo	train
excelente programa felicidad	train
mientras ser candidato candidatura decir	train
candidatar presidencia volver presidente proximo periodo pic twitter com ivlgeshuad	train
buena palabra valorar trabajo movimiento catolico formar conciencia social	train
armar mesa lujo compañia solo	train
ir haber pedir juicio policito renuncia presidente	train
haber confundir jerarquia catolico feligresia catolico	train
foto tambien porfa	train
seguir pasar genial compañia señor intendente ciudad pic twitter com cfspyhmeg	train
xq hacer hablar tito ibarrola	train
risa total	train
genial programa totalmente original	train
mirar pensar poder ser mas insoportable arturo rubin alvaro hacer trabajo encomiable	train
am ser hazme reir	train
gustar	train
señor intendente gran guardar mesa coleccion	train
programa presento	train
espectacular junto saludo cde	train
ahi intendente figueriti q lastimosamente tener prensa amiga vez trabajar x loa mercado controlar asi ir	train
intendente asuncion sumar mesa solo	train
conocimiento aprender mismo bus electrico s	train
dudar anibal	train
ir antojar sacar hija mil putada q ser giro izq ayalar altura ise	train
hoy cumplir gigante recorte hacer año ser censurar asuncion dictadura publicado x pic twitter com uxkiejwie	train
ser valiente salvar gatito afrontar corrupcion esconder	train
ciudadano sr intendente alguien ocupar edificio historico ciudad	train
concejal arregui solicitar hacer tiempo recibir amenaza muerte ser peligroso pedir dato	train
si poder pedir informe especifico	train
ley transparencia publico deber publicar www jma gov py listado funcionario salario cargo beneficio	train
ser casa clari	train
sugiero hacer desaparecer cable ensucir dificultar visual palacio lopez	train
exigimos explicacion	train
ser obligacion municipalidad ciudadano buscar mejorar ambiente	train
ser lastima llegar turista domingo playa san isidro recorrer ojala pronto habilitar	train
mirar tuit fijado primo	train
hagan uds nota asi oyente enterar	train
ser primero poner buscar pic twitter com zlfotjd	train
serio nadie hacer	train
parque c antonio lopez luz pic twitter com igjqrtts	train
imbecil quiere tomar pelo tener	train
embotellamiento salida snd cos dia hora pmt please	train
veredar obstruido auto vereda auto s calzada varios poder sacar foto ojala multar crer impun gracia	train
denuncia procesado	train
agradecer dato procesamos denuncia	train
juicio politico cadena perpetua fusilamiento gata floro histerico	train
poder decir ten razon	train
si ten valor mandar poner orden pc mateo docena auto mal estac mcal lopez multar	train
segui llorar	train
fondo foto tal eh	train
pio ser am alguno sicario punteria alguno empleado gran contrabandista ser tener miedo	train
plaga siempre mas pendiente encontrar infractor ayudar descongestionar transito plagasssss	train
cc	train
acto politico frente guasu manzana rivera dependiente si ser peño am abc pedir juicio politico pic twitter com nfdtghwl	train
sajonia tb ser asuncion porfa intendente si poder ir bachear zona fcm	train
mismo imputado sr figueredo q mal sistema judicial	train
encarnacion casi rca argentino mañana mismopic twitter com mbivycph	train
joya orlar	train
mcal lopez casi brasilia pe estacionar frente pc carlos mateo tal si multar	train
show charly garcia apto quinceañera paraguay stroessner via pic twitter com lurmpe	train
barrio s vicente acordate calle pampliegar desastre usar salir gral santos	train
bien	train
bien	train
coleccion ser	train
excelente iniciativa falta conciencia conductor	train
pedir informe publico	train
pasar mil año ahora ir construir sitio honrar memoria mejor trabajar dignificar vivo	train
calle asuncion tambien parecer demolida crer faltar recapado	train
siempre divertir entrar ver respuesta siempre haber plagueo bobo avance publicar pic twitter com ahlwzfll	train
si fijar haber vehiculo vereda incluso pedi ayudar tampoco tener eco hacer año aguantar	train
sera poder procesar hoy hacer año denuncio hacer respecto	train
agradecer dato procesamos denuncia	train
canalizar denuncia	train
ser momento dar vuelta necesitar accion parte dejar playa condicion	train
seguir esperar rapido reaccion accion cuyo director comprometer cumplir encarnacion	train
ser escaso margen tiempo restar llegada masivo turismo aun ser trabajo quedar hacer	train
dejar mapa ubicacion centro municipal poder realizar pago reclamo curso mas pic twitter com zimoeqem	train
ahora mal educado rsperar cartel franja estacionamiento manuel dominguez antequera tacuarypic twitter com mrbknxbzt	train
señor seriar amable venir hacer trabajo retirar vehiculo dia molostar foto ser ahora mismopic twitter com cuklnjbeg	train
cartel pare colocar interseccion saravi campo cervera ver distancia pic twitter com scldorbio	train
ser hora nde haragan	train
suerte votar	train
lamentable	train
trabajo limpieza retiro basura inmediacion cancha vy rendo penitenciacer tacumbu pic twitter com mgjbmxllz	train
construir encima	train
tambien pasar menudo dia ir fiesta grande haber basurero novedad ser haber funcionario limpiar	train
gomez castro casi andradir	train
auxilio obra echar casa denunceir seguir ir prensa pic twitter com afzauatgi	train
mono andar suelto jardin botanico pic twitter com bayapsu	train
utilizado aca caraja necesito bacheo urgente lleno pozo varios cuadra mcal lopez	train
herida abierto asunceno bueno ser ser espacio cultura	train
holar don mario si pedo contar anecdota r m visita incognito py	train
pedir intervencion orden	train
buen dia asi ser consulta mopc orden	train
buen dia sergio haber comunicar responsable area gracias preocupacion	train
direccion exacto serio avda sacramento nstro señora carmen frente colegio aula vivo	train
epoca casa tambien tener partida	train
gracias	train
ciudadania deber entender colaborar mayoria plagueir tampoco respetar señalizacion	train
holar partir año ser considerar adulto mayor	train
deber multar gente intendente haber caso gente seguir tirar basura calle	train
pregunta capaz corresponder hacer xq obra metrobu trabajar hora turno avanzar mejor	train
felicitacion comuna necesario educacion vial	train
avenida ayala dar mas poder hacer respecto	train
cc	train
esperar poder reconstruir abasto ayudar gente manera pueda	train
cuanto dolor lugar solo ver revivar sufrimiento involucrado herida abierto trinidens	train
comprometer mario solo despues uds importar carajo avir coima privilegio amigos sic	train
atender nadie gracias forma	train
buena partir edad poder participar persona feria gracias	train
continuamo realizar respectivo censo permisionario ser re ubicar	train
gracia dato julio derivir vialidad orden	train
buen dia fernando comunicar responsable gracias preocupacion	train
limpio ser aquel limpio dia sino menos ensucio ciudadana todavia aprender ensuciar despues plagueir	train
pregunta ser poder construir vereda calzada	train
asi pettirossi genio igual achicar incluso permitir estacionamiento ambos mano	train
emombe menchipe	train
esperar equipo poder ayudar afectado demostrar responsabilidad tragedia seguir demostrar	train
zona villa morra ejemplo cruz chaco alrededor respetar señal pare ahi tener intensificar	train
reclamo realizado ser escalar dir vigilancia esperar retorno gracia	train
si propio grua ladrones estacionar dnd decir garage manduvira respetar querer dar leccion guau	train
reubicar costado humo ser insoportable vean apagar fuego vez favor bombero decir ser uds pic twitter com toaiwbpl	train
excelente mismo poner gestionar	train
arte abandonado ser bueno ver gobernante apoyar actividad	train
consciencia gente tirar basura ser	train
si ser requisito indicar bloque piso hacer rapidamente acudire hacer	train
buenisimo equipo tener confianza trabajo ser favorable abasto	train
gracias	train
tierra mal	train
buen dia tomar nota comunicar vialidad orden	train
verguenza dio contribuyente aportar mantener planillero hurrero	train
sancion negligent	train
lleno floripondio	train
imposible trafico mañana	train
calle charl gaulle victor idoyacer alfredo seiferheld necesitar reparacion favor	train
tierra si calle	train
si obra realizar paseo central avda ta ser aprobar asi simple ser	train
ser mas lindo eliminir giro izquierda mcal lopez	train
gracia pronto respuesta	train
buen dia manu gracia indicarno brevedad compañero lugar retiro residuo	train
denuncia procesado	train
cuchillero	train
sorpresa estamento publico ser asi fin empresario pais tampoco ser capaz generar empleo	train
faltar visitar empresa mas mio ver si encontrar alguno irregularidad cerrir coincidencia luego turno	train
holar movil estacionado lugar prohibido costado parque carlos lopez vengar	train
si ahi quedar atascado abajo tls correspondiente paso recordar reclamo ciudadano gracia	train
si capitanar listo	train
listo versus vinilero tio jorge vs mario	train
tendria saber guardar mas silencio acompañar campaña politico carlos ser gracioso vo so desubicado	train
par favor retirar basura zona trinidad itapua puerco ir llamar telefuturo core	train
av peru santo domingo necesitar urgente señal pare control ser impresionante respetar accidente zona	train
