exelente saludo nycity	train
ahora mismo auto agarrar carril derecho mcal lopez	train
siempre mismo cosa frente casacor entrar sol estacionar mcal lopez	train
pared tener llamar candidato exigirlos reparir daño sancionarlo ser chiste tema	train
hacer año ahi poder girar izquierda ambos lado salvo confundido	train
kike decime municipalidad deber gastar dinero pintura pagar jornal personal repintar	train
holar protejan trabajador favor poner valla cartel	train
recoleccion realizar diario turno noche rafo gracias colaboracion	train
mra tambien deber implementar mismo ser cuestion poner acuerdo hecho mopc deber hacer muni	train
peru c mcal lopez tbn siempre	train
dos año intendente asuncion cada dia lucir mas horrible ser lugar mejorar empeorar sr	train
aviador chaco pedir grito poner pavimento nuevo arreglir paseo central cerrar cloaca abierto costa	train
acompañar comite gestion riesgo cordinado p verificar avance trabajo logistico abastopic twitter com mzllfioqmp	train
favor eliminir tambien giro izquierda avda fernando mora taruma	train
señalizen evitar accidente lamentar	train
capo mario aprender filicoptero eterno perdedor chicanero	train
ojala tener buen razon estacionar asi	train
entonces higgins ser doble parte	train
tambien esquina rod francia u enorme cart candidato colorado	train
hacer año prohibido giro izquierda interseccion	train
poder denunciar lugar exacto arrojar si si deber haber camara si responder favor pic twitter com ihqjpdqkc	train
buen momento aplicar pintura anti graffiti ser mas cara pic twitter com rnnlumbz	train
poder ser farol intendencia cueste mantenerlo manuel dominguez paraguari pic twitter com pbyaungyg	train
convenio ser hugo ramirez concejal asuncion	train
ir semana twet seguir haber agua peru mcal lopez chupar huevo	train
sancion responsable negligencia	train
año pasado gente murio dengue hacer supuesto campaña concientizacion mantener limpio	train
querido intendente candidato tener obligar dar plata gente	train
terror ser situacion nadie importar siento impotencia	train
hacia lado ser asuncion lambare	train
dos municipio dividir avenida ninguno hacer responsable querer ir ahi literalmente muero si volver agarrar dengue	train
lado criadero dengue parque peron departamento criminal ser situacion	train
tremendo comision dj	train
tambien vane dengar hemorragico dia internado trotar s boggiani pleno zona residencial imaginate basura mosquito	train
arreglar calle favor inutil	train
año pasado hijo tener dengue hemorragico chica murio hacia zona dejar huerfano ir actuar	train
eusebio ayala victoria pic twitter com fpzimjys	train
hacer calle crer poquito pasado copa	train
criadero dengue basural costado avenida peron pic twitter com bwvjebolc	train
invertir total millon guarani	train
hacer obra lugar olvidado historicamente	train
obra hacer gracias encarnaceno pagar impuesto	train
buna tarde jose gracia indicarno brevedad normalizar servicio saludo cordial	train
haber aviador cerca paseo galerio arnaldo samaniego imaginate llegar turista ver	train
eliminacion giro izquierda avda fernando mora kubitschek	train
brasilia luis granada haber cartel	train
gracias responder	train
holar querer avisarl ahora pasar lunes dos lunes seguido ir	train
seguir igual mil litro agua potable perder pic twitter com qyobfvhihk	train
haber gigantigrafia politico españa casi sacramento destiempo suponer tmbn	train
ir sacar pintar tb dos hugo ramirez verdad	train
gracia apoyo constante lunes noviembre diario g pierda	train
haber andar cuanta cuadras ver tipo publicidad electoral ser tiempo ver querer	train
ubicacion vi ser mcal lopez trayecto kubitchek san martin venir centro	train
si ser ilegal ser totalmente descarado cartel electronico luminoso gigante exhibir propaganda electoral partido colorado	train
mismo deber esperar buen voluntad	train
deber hacer gente multar candidato cuestion xq municipalidad tener hacer trabajo	train
copiado	train
buenisimo notificacion empresa medio solicitar sacar pantalla gigante cartelerio favor	train
tener multar empresa firmar contrato candidato publicidad leds ilumacion	train
pasar avenida españa sacramento	train
pregunto incluir tbn carteler luminoso haber ver propaganda cartel lumioso mcal lopez hoy	train
calle presidente franco tener pozo nuevamente	train
hacer mas mes hacer dejar asi esperar alguien matar top cemento pic twitter com xdiyrpsdoh	train
cerrar pedo paseo central entrar hacia kostianovsky hacer mes seguir lleno escombro verguenzapic twitter com ntztijlebb	train
favor solucionar tema f machain ser solo mano rca argentino saquen trampa mortal poner c recalde	train
deber dar baja valla via publico empresa publicidad publicidad pantalla led ser mismo supongo	train
loco	train
recuperacion hermoso parque	train
esquina charl gaulle campo cervera parar auto pasar si cartel existierar	train
acordate inutil samaniego licuo presupuesto retirar	train
haber hacer haber elegir alli persona querer hacer bueno elegir peor	train
opcion ser limitado poder recibir respuesta ser problema complejo saber hacer	train
opcion poder demandar resarcimiento empezar embargar fondo ser mas agil reparar	train
solamente abonar gs esperar	train
crer tener tiempo menos proponer alguno solucion igual concejal diputado ej municipalizar agua	train
ser responsabilidad	train
holar procederer retiro residuo encontrar calle mientras baldio	train
hacer mil funcionario municipal mantenerlo	train
ser reinante ignorancia vial vida calle ser sobrevivencia mas prepotente parecer excelente campaña necesario	train
agradecer dato procesamos denuncia	train
trafico brasil frente mspb ser desastre auto mal estacionado	train
excelente intendente historia pasar cristo rey	train
seguramente tirar basura	train
x favor castigueb alo k respetar pare	train
buen dia celso derivir pedido transito orden	train
chica imposible caminar ayala choferes rca arg chatarra desarme estac doble fila full hacer	train
si tan solo poder mantener onda verde calle avenida ser gran ayuda trafico pic twitter com lbegyge	train
tener aguante mantener comunidad parentela	train
sero q poder poner cartel pare montevideo proyectado accidente lomada hacer lejos cruce urgente	train
genial hoy desaparecer bache	train
pasar hoy teniar pasarmar n reclamo mientras haber mas bicho ahora	train
respeter señalizacion lomada utilizar reducir velocidad ser atraso ideal ser campaña vial tv	train
crer q dificilmente poder arreglar menos dos año q anterior adminitracion hacer mas decada	train
feroz cartel arnaldo chanti pena frente ministerio justicia	train
tapa impreso calvario diario caño roto agua servida gracias	train
intendente concejal diputado asuncion candidato diputado tener plan	train
exigir accion bastar queja deber haber estricto control	train
gracia tocar tema venimos reclamar inaccion crear cuenta plan	train
seguir lpmpic twitter com sxvybkjs	train
estacionastir moto renato anike dejar frente casa ir llamar grua	train
proceder retiro extemporanea av felix bogado ir proyectada pic twitter com yumjiemyix	train
faltar mantenimiento señalizacion calle	train
deber poner tb lomada reductor velocidad cruz cartel pare tapado tb	train
tener funcionario ser colmo deber pagar mas	train
porrr favorrr arreglao callossss mario dejar joder	train
agradecer dato procesamos denuncia	train
holar poder consultar dm	train
cambiar señal pare deber publicar situacion ser criminal difundir	train
medio favor nadie respetar señal transito	train
urge campaña educacion vial colocar cartel nombre calle reparacion semaforo recapado avda aviador chaco	train
olvir	train
asi ser publicar hacer	train
mexico casi manuel dominguez pic twitter com pulnytf	train
sero q poder poner cartel pare montevideo proyectado accidente lomada hacer lejos cruce urgente	train
ahi poder quitar niño pedir dinero trabajador informal limpio vidrio mejor dicho asaltante diurno	train
propaganda electoral ser plazo electoral avda def chaco c acceso sur mojon	train
pensar tercerizar impuesto asuncion quedar empresa privado	train
grande aco barrio republicano necesitar reparacion asfatado calle japon pdas	train
respetar reglamento trafico x factor señalizacion zorro coimero pesimo calle	train
tarea atrasado hacer mes ahora recien terminar ser viaducto	train
deber haber multa economico sancion alguno tipo incumplir tiempo establecido aplicarlar	train
arrancar semana nuevo señal transito moises bertoni c gral garay carajo hacer contundente pic twitter com fgnpepu	train
bienvenido pais r mundo	train
video excelente	train
previamente haber generar conciencia vial estimular participacion activo involucrado flanco fallamos	train
ser solo cuestion señal ser cuestion cultural educacion vial haber generar educacion correctivamente multa	train
excelente propuesta importantisimo cultura historico	train
primero presidente madame lynchpic twitter com mwyuimoex	train
buen dia haber atencion central pregunto manifestacion gracias	train
faltar tambien er presidente mme lynch	train
cruzar frente auto ir hacer san lorenzo peligro total volante imprudente	train
seguridad vial ojalar forma aprendar respetar ley transito aun igual haber alguno aprender l	train
hoy vehiculo carril mcal lopez ir centro semaforo verde gira subir rca arg ojala tener fotomulta	train
podrido descomponer vehiculo sufrir dia histeria culpa jefe municipio	train
seguir mismo pic twitter com jjneyoe	train
incompetente haber solo calle sufrir pozo enorme dejar municipio abandono falso promesa politica	train
sr intendente hoy octubre ciudad asuncion parecer ciudad abandonado hagar cargo retirese	train
procesar denuncia	train
buen dia favor registrar reclamo opcion	train
gracia habrio ubicar contenedor zona diario suceder situacion resto comida animal esparzar	train
jajajajar nunca usar uniforme clase superior ser	train
micro chatarra descompuesto avda españa roa bastos asa sacar circulacion pic twitter com lzfjorasxe	train
buen dia nestor compañero lugar verificacion correspondiente saludo	train
buen dia mai residuo ser retirar brevedad saludo cordial	train
thanks	train
acuerdense manejar cuenta muni ser hurrero mas dejar arnaldo pedir	train
reclamar lomada dar pelota domingo pasado casi ocurrir accidente haber niño plazita	train
buen dia gracias escribirno proceder retiro brevedad posible saludo cordial	train
señor	train
buen dia s r fernandez mil disculpa nombre personal haber comunicar accion p establecer medida respecto	train
santo domingo c avda pozo favorito solucionar mejor si poner lomada alto frente plazoleta bajear loco haber niño	train
buen dia comunicar vialidad orden	train
ser agente gritar calle si saber tener hijo esposa gritar puto	train
buena jose realizamos denuncia correspondiente	train
buen dia comunicar direccion pmt gracias dato	train
gracia tener excelente jornada	train
copiado	train
buen dia pasamos transito solicitud orden	train
buen dia derivamos tecnico propuesta orden	train
buena intendente dr paivo alferez silva barrio san antonio faltar señalizar contramano ser peligro dia gracias	train
buen saple multa mejor colectivo ser peor tirar ventana basura	train
buen dia zumi indicar numero expediente denunciar	train
procesamos denuncia	train
cobertura p m t avda peru petirossi pic twitter com eajwjfd	train
cobertura p m t colegio palomino pic twitter com zqahiwhpi	train
buen dia manuel realizastir denuncia atencion ciudadano	train
exoneracion pago multa recargo noviembre pic twitter com svcnzpvp	train
tomar nota luis tambien pedir registrar pedido garantizar atencion ordenes pic twitter com geqyanyiz	train
lastimosamente responder	train
mal educar agente enseñarl brindar servicio ciudadania problema personal dejar casa	train
sumar seguir lista socorro aguantar	train
buen dia insistimos orden	train
asi ser lilian tener razon gracia aporte	train
buen dia pasar dato orden	train
insistir carlos orden	train
agradecer dato canalizar denuncia	train
semaforo dañado nuevamente interseccion unidos fulgencio r moreno favor reparar gracias	train
cobertura p m t avda mcal lopez san martin pic twitter com sxygdlb	train
cobertura p m t madame lynch primero presidente pic twitter com vmtdnnyofs	train
cobertura p m t zona institucion educativo asuncion pic twitter com stydbzajn	train
cobertura p m t villamayor puerto pic twitter com ebnrnalf	train
semaforo eu fulgencio r moreno quedar colgado lado dar rojo amarillo crear confusion peligro pic twitter com hbbbsfxoh	train
am mayo c gral diaz asi amanecer asuncion lunes casi dia veredar esc brasil pic twitter com ocaurka	train
ojala ser verdad	train
multa blf movil luz freno lado izquierdo luz delantera bajo funcionar pic twitter com aislsieyru	train
lluvia lluvia basura basurero perjudicar vo perjudicar	train
aviso meteorologico sistema tormenta intensificar llegar hacia gran asuncion fuente d m h pic twitter com ijohrrzvz	train
quedar hacer	train
ciudadano tambn	train
hacer mes solicite pintar franja sacramento españa ahora	train
excelente mario entodas arteria entoda esquina ir	train
intendente concluir obra empezar desastre peligroso paseo central rca argentino escombro tierra canal feo	train
unico pedir amor dio semaforo mas asuncion existir onda verde	train
x favr castigar vez tarado k respetar pare ser unico manera k gente respetar	train
paraguay cada vez k ver letrero pare detengo auto k venir detra bocinar putear chocar	train
calle pariri ir arreglar essap rompio tener crater cada metro	train
coston solo insumo pagar inscripcion	train
buena noche fin semana haber actividad acompañar resguardo asistentes pic twitter com rxnmbh	train
ser fin	train
hora	train
hacer control costanera	train
buen mario gustar estes comprometido trabaj cansancio felicitacion	train
practicamente ser asi mayoria junta ser partido tradicional atraso	train
ver cambio asuncion nunca arreglar asi ver calle	train
si preguntar segun informe parecer ser llevar caño	train
coincido gente respetar tocas bolsillo re aprender	train
usar lomada ser atraso simbolo respetar velocidad	train
incendio ycuo puerta abrir hacia dentro mireir aco poder morir mas ud tener palabra pic twitter com tblbndqzfq	train
retweted muni asuncion domingo costanera volver mas deportivo esperar	train
hacer tiempo tener luz esquina juan garay alferez silva ser peligroso	train
siguiente lectura acto gaspar r francia ser terrible ansia publicidaf	train
pda casi rojo silva ausencia municipalpic twitter com gjuymgis	train
multar faltar ley transito duelar bolsillo volver hacer	train
educar ser critico dictadura bregar democracia ahi ser marxista	train
esquina falta bacheado tambien	train
lomada realidad deber existir poner gente jugar carrera	train
gente ser inconsciente respetar señalizacion ser trabajo	train
interesante iniciativa hacer mas promocion tour	train
calculo solo asunceno ensucia mercado lugar asuncion	train
excelente recomendado interensante buen propuesta	train
preferir hacer coimear ser mas visto mas ocupado entonces coimear noma	train
niño calle falta vereda ordenanzas pic twitter com dptmfmmaur	train
hija mil mariconcito hacer falta pio arrobar jefe	train
permitir ninguno ideologia mas derecho imposible si m decs q prohibr dictar ideologia mal	train
igual manera agradecer dato	train
cada poblador asunceno necesitar personal cuadrilla municipal alce suelo basura querer tirar basurero	train
si ser chiste	train
favor si hacer barrio villamorra exactamente gomez castro andradir haber bache colocar peligro pic twitter com lgcnnopgh	train
cuidacochar dentro cpj pic twitter com zkcedrweg	train
magui pedir intentar razonar argumento saltar respuesta	train
ok saludo paraguay libre ideologia mec ministerio educacion ciencia mayuscula x si	train
mario xq mandar rescapar calle asuncion si ir ser excelente intendente	train
buena tarde cualquiera dos termino ser valido control alcoholemia alcotest	train
haber desarrollar campaña gente tirar basura basurero mas suelo crer pasar educacion	train
ser dijistir ser demasiado estupido entonces saber responder dejemoslo asi	train
entrar malla curricular cole enseñar si padre d acuerdo q hacer negar estudio año	train
enviar hija colegio decidir educacion recibir	train
cri cri ser abogado fernando lugo intentar interpretar constitucion nacional	train
ser bueno ler pasado veces mañana lunes volver pasado siempre serer capital futuro	train
clase alto tambien haber multar parecer	train
tod ser malo epoca dla dictadura si foment ideologia si ser dictadura ser loq algno quiern pleno siglo xxi	train
sebastian supuesto ninguno ideologia presuponer ideologia educar nunca abstraccion neutral aseptico	train
ser pleno dictadura si saliar norma epoca comunista contexto	train
ojala movilizar sepa si cumpli haces cumplir ordenanza obligacion ir poder tener pelicula mas	train
deber permitir fomentar cualquiera tipo ideologia puesto q ser padre responsable enseñar ideologia religion etc	train
control alcoholemia cargo p m t apoyo policia evento deportivo pic twitter com uqffzokrw	train
don arnaldo samaniego pic twitter com vqcqhbzs	train
epoca ser colegio hombre saber x alli	train
j haber upei	train
propio intendente hacer gala infraccion transito poder costar vida	train
cualquiera parecido actualidad	train
intendente asuncion publicar recorte diario argentino clarin intervencion colegio lean pic twitter com nmouxctvy	train
dueña gracias	train
decir bien frente jokey club km	train
frente jokey club avda eusebio ayala ser intransitable recorrer na hacia pereira ruiz diaz mejor intendente tener	train
excelente cobertura p m t	train
deberiar ser ser menos coimero	train
bache dijistir q iba solucionar	train
ojala alguno dia hacer cumplir previo campaña vial lindo señaletica nadie cumplir hacer cumplir	train
tal papa consulta cargo refugio parada obligatorio avenida artiga	train
costanera feo lider ser unico parte aceptable hagale chili	train
poder pintar bien pa cal duro mes	train
buen mario	train
urge pintar lomada ser peligro si ver tiempo	train
viejo sr robert	train
seguir asi mas triste ser nacer nuevo bache lugar	train
ser fundamental señal horizontal transito embargo deber ser tecnologia superior termoplastica adelante	train
caño roto bache denis roa c andradir pic twitter com varmzkdux	train
formacion personal p m t cobertura servicio canchaber club guarani pic twitter com lmfuydai	train
agradecer dato procesamos denuncia	train
jajajajajajajaja	train
correcto	train
tener jurisdiccion lambare	train
mas probable ser chica subir semaforo	train
tte garay centenario barrio san vicente pic twitter com olnxrhewe	train
bueno	train
haber convertir cementerio jardin cama subterraneo	train
ser verguenza pintar indicacion calle asfaltado pintura ta comun esmaltado crer q engañar	train
cierto ayer comi lomada señalizado vamona	train
prohibicion asuncion giro izquierda implementacion giro derecha semaforo costar	train
ir tener limpiar	train
si agente pedir coimo tener ninguno prueba poder hacer	train
haber calle colocar señal horizontal solo esquina	train
conoz frase letra c sangre entrar ok señalizar educar saber regla multa fuerte ser solucion	train
utilidad sero total si señalizar largo calle divisoria carril area estac solo colocar esquina	train
cobertura p m t costanera asuncion pic twitter com zomxmply	train
urgente multar peaton tambien cualquiera lado cruzar cambio mismo ser mejor	train
calle roto tambien formar parte tarea señalizar	train
favor hacer interseccion brasilia artiga ocurrir lamentar	train
educacion ser primordial nadie respetar nadie	train
haber hacer prevencion esperar vuelta esquina multar	train
kp	train
cuid adulto mayor	train
gracias mario igual	train
cobertura p m t maraton colegio tecnico javier pic twitter com agshftewj	train
pasar mismo anoche frente pirata preferir pagar impuesto muni cuidacoches hacer	train
poder coimear si vos coimea ahora si vo acepta ser cosa	train
control remoto ser publicidad encubierta	train
salimos desayunar dalar pasar buscar vehiculo oficina beso c	train
camion gran porte santa rosa hecho cable zona	train
ahi marcar anda medio hacia querer si venir hule	train
dia costanera	train
hacer tres dia agua desperdiciar cuadra entero olertir casi pdte franco pic twitter com iwwffljv	train
xq pasar ver colectora m lynch mes hecho peloto c vez q llover cao	train
abrazo mario	train
disco escuchar completitir hoy	train
cobertura p m t caminata amor rosa aviador chaco madame lynch pic twitter com wvuizcwukq	train
rt	train
ahhh querido tener dos solucion where strets have namir highway to hell despues decir preparado pffft	train
cobertura p m t corrida incar aduan costanera asuncion pic twitter com bzglxh	train
cobertura p m t mercado abasto pic twitter com osilzmje	train
deberia preocupartir mas deteriorada calle ofrecer curso nadie interesar labura hombre figureti	train
seguir lucha parque pavetti galer mercader pro	train
gente estacionar ratito noma	train
ser misterio calle stranger things poroto	train
ser solo mano hacer cambiar ahi	train
ser gente lomitero	train
arreglar acseso ponner desague pluvial va pda zona colectoro	train
aurelio informate tratar tour despues opinar parez pagado encontrar excusa cualquiera cosa	train
encontrar flia encontradar v morra zona colegio alvarin romero	train
deber hacer respetar ley transito semaforo intermitente deber ubicar reductor velocidad	train
hoy pasar ahi imposible olor mierda haber paso	train
respeto tener lomitero aviador ser terrible	train
gran emprendimiento espectacular	train
mario ipora nde tour haber cosa menos lugubr visitar justo vos ocurrir visitar cementerio hallowen pio	train
c c cuider parque	train
expresion cultural juventud pasa pues hspic twitter com abzrrhk	train
dalir mario gente querer playa limpiapic twitter com iupzrplsm	train
paso humaita señora pic twitter com omppnthy	train
humaito esquina nstrasro pic twitter com unrslwrq	train
buena tarde gracia indicarno brevedad proceder retiro saludo cordial	train
apuro ir	train
cobertura p m t asualtavoz pic twitter com belimno	train
problema vinilo	train
semaforo brasilia españa venir artiga mariscal lopez ver rojo rama arbol tapar urgente haber podar dejar visible	train
asi mismo	train
tomatir medio hora ver episodio lomitos leyenda	train
perdon apuro equivoquer ser exactamente reves c cervera ser preferencial gaulle tener mas trafico s r gonzalez	train
entender ejemplo c cervera tener preferencia s r gonz gaulle ser ultimo mayor trafico	train
capilla ser propiedad privado gastar dinero publico mantenimiento costear diocesis correspondiente	train
zona mas top asuncion olor cloaca mal	train
nauseabundo av santa teresa denis roa destrozado pavimento inaccion falta atencion pic twitter com zgzifmc	train
estacionar area habilitado efecto hacer	train
criterio declarar preferencial calle ser si alguno linea colectivo pasar ahi nivel transito	train
encontrar dos auto esquina dos calle mismo preferencia tener preferencia vehiculo venir derecha	train
avenida doble ser preferencial despues venir calle unico ultimo calle doble	train
estaciono lado derecho	train
tablero mario tablero	train
hacelir caso corazon	train
usar imaginacion	train
che onda kostianovsky hacia tener ir poder estacionar ambos lado carril uso pic twitter com dcjetlsjoj	train
estarer verificar servicio zona fin regularizar posible	train
gracia retorno saludo cordial	train
verde funcionar izquierda derecha escondido detras columna ser chiste	train
semana deber hacer nadie respetar limite velocidad	train
semana poder hacer valet parking cuidacoch pibe ser estacionar reservar lugarespic twitter com bvdwlz	train
director pmt indicar disposicion conos p reduccion velocidad costanera asuncion pic twitter com hlcbrbo	train
cobertura p m t zona costanero asuncion pic twitter com skzgyhsk	train
buena tarde oscar podria indicarno direccion exacto favor	train
ser chiste d vereda dspues multar x tirar basura calle multar x hacer trabajo	train
acabar pasar camion recolector vez mas llevar vereda ser problema turno nocturno ser pasar	train
totalmente acuerdo	train
hugo preguntar nadie responder ser criterio hacer preferencial calle	train
si aminorar marcha mira pasar ten manejar pues apeligrar resto si tener consciencia	train
zorrilla san martin s lopez filippis bo san vicente correr agua arroyo asfalto	train
excelente trabajo gracia	train
faltar sensibilidad quedar ayudar	train
personal lugar despeje pic twitter com rfaxhkyd	train
vo pensa madrugada alguien ir parar semaforo asi rojo	train
increible nadie tampoco gente alma	train
motivo deber funcionar noche semaforo cruz importante	train
registrar denuncia	train
buen dia direccion favor	train
sr intendente mire video necesitar intervencion municipal barrio herrera criadero mosquito mosca alimaña pic twitter com sfwkdwwn	train
favor par direccion jajajaja bolido	train
cobertura p m t avda defensor chaco entrada saprocal mercado abasto pic twitter com uxxtvnup	train
claro señal desidia innecesario deber cuidar niño mano obra pic twitter com gldquksr	train
hacer inutil adicto dejar tocar noche dia abrir ojo pod gran irresponsable	train
boggiani casi ri gral diaz haber bache tapado agua agarrir mitad calle	train
aguardamos ancioso semana semana	train
buen dia gracias escribirno brevedad proceder retiro saludo cordial	train
cobertura p m t mercado abasto pic twitter com cmljigrxx	train
asualtavoz busca identificar nuevo expresion cultural juvenil esperar hoy rivero pic twitter com vpyluye	train
artiga cerrado carril cuadra botanicopic twitter com odtqpypffk	train
hacer dia arbol caido tapa parcialmente entrada autopista ñu guazu ir calle itapua pic twitter com fprahrhyy	train
fernando mora san lorenzo haber trabajar comision vecinal detectar delincuente crio luis pablo cantero	train
deber sacar resolucion establecer requisito querer alquilar casa ciudad crio luis cantero	train
vez pasado denuncie foto incluido medio dia jamas aparecer zona villa morro	train
dia pasar zona ser solo mirar percatar centro villa morra etc cero control	train
san jo españa igual peor	train
volver fotomulta favor	train
